id,question_text,option_a,option_b,option_c,option_d,answer,difficulty,difficulty_numeric,answer_numeric,tag_encoded,option_a_numeric,option_b_numeric,option_c_numeric,option_d_numeric,correct_option_value,question_length,question_word_count,options_mean,options_std,options_range,answer_position,difficulty_rarity,difficulty_bin
Q000206,The company let me _____time off work.,take,taking,to take,took,A,Very Easy,0.0,0.0,4,821.0,1135.0,1172.0,845.0,821.0,-0.7083697372242533,-0.6713979247602943,-0.405359088575121,-0.26511799616114506,-0.3077219892336593,0.0,0.011111111111111112,very_easy
Q000207,I assume _____with me.,everyone agreeing,that everyone agrees,everyone to agree,that everyone to agree,B,Very Easy,0.0,1.0,4,2255.0,2465.0,2255.0,2665.0,2465.0,-0.9231926791618641,-0.8709542246993252,0.3126982870565163,-0.25413589090290695,-0.2778129695816043,1.0,0.011111111111111112,very_easy
Q000208,"_____the rain forests is very important, if we do not want the flora and fauna found there to become extinct.",Reserving,Destroying,Preserving,Maintaining,C,Very Easy,0.0,2.0,4,1413.0,1514.0,1511.0,1605.0,1511.0,0.24490706762389453,0.19334604164217298,-0.14307238175361237,-0.3743396792856746,-0.3883242625332651,2.0,0.011111111111111112,very_easy
Q000209,I haven't had _____opportunity to study during the day.,very,many,much,more,C,Very Easy,0.0,2.0,4,854.0,837.0,829.0,835.0,829.0,-0.4801203614155418,-0.538360391467607,-0.4836649749595134,-0.4431262631830056,-0.47298199612467495,2.0,0.011111111111111112,very_easy
Q000210,When will you hand _____ your assignment?,in,back,down,into,A,Very Easy,0.0,0.0,4,415.0,801.0,840.0,842.0,415.0,-0.6680904356109513,-0.6713979247602943,-0.5415707841466774,-0.24349612163191067,-0.26919511646152067,0.0,0.011111111111111112,very_easy
Q000211,The resort is_____ the lake.,from,has,besides,beside,D,Very Easy,0.0,3.0,4,836.0,616.0,1219.0,1119.0,1119.0,-0.84263407593526,-0.8044354580529814,-0.42854675396079056,-0.17548145860527004,-0.17997499004183123,3.0,0.011111111111111112,very_easy
Q000212,The monitor takes care _____the class_____ the absence of the teacher.,in; at,of; in,during; in,of; for,B,Very Easy,0.0,1.0,4,1003.0,1009.0,1546.0,1106.0,1009.0,-0.2787238533490317,-0.4053228581749197,-0.31780347774726475,-0.1921862695043017,-0.21039094223036173,1.0,0.011111111111111112,very_easy
Q000213,"When he saw the fish swimming _____the river, he was extremely happy.",on,besides,in,at,C,Very Easy,0.0,2.0,4,421.0,1219.0,415.0,413.0,415.0,-0.2921502872201324,-0.33880409152857605,-0.5960554623752999,-0.046225130355808296,-0.07706768513730307,2.0,0.011111111111111112,very_easy
Q000214,"The railway coaches_____ by the Integral Coach Factory, Chennai.",is manufactured,are manufactured,are manufacture,is being manufactured,B,Very Easy,0.0,1.0,4,1958.0,2053.0,1953.0,2551.0,2053.0,-0.3592824565756358,-0.538360391467607,0.1701511637839573,-0.1642027404396566,-0.18250965272420877,1.0,0.011111111111111112,very_easy
Q000215,The truck was _____ when the bus rammed into it.,stationery,machinery,machinery,stationary,D,Very Easy,0.0,3.0,4,1549.0,1414.0,1414.0,1549.0,1549.0,-0.5741053985132466,-0.47184162482126335,-0.15789728257395852,-0.3748243323452196,-0.41721941711236904,3.0,0.011111111111111112,very_easy
Q000216,The teacher let us_____.,to go early,to leave early,go early,early to go,C,Very Easy,0.0,2.0,4,1573.0,1868.0,1244.0,1641.0,1244.0,-0.8963398114196627,-0.8709542246993252,-0.10721386096593753,-0.19193470204828889,-0.16932940677584554,2.0,0.011111111111111112,very_easy
Q000217,Jane is annoyed ______,on me,with me,against me,over me,B,Very Easy,0.0,1.0,4,963.0,1176.0,1512.0,1176.0,1176.0,-0.9231926791618641,-0.8709542246993252,-0.29714998344199617,-0.22345059712575305,-0.20734934701150867,1.0,0.011111111111111112,very_easy
Q000218,A big dictionary _____ the table near the door.,are on,is over,is on,is up,C,Easy,1.0,2.0,4,1055.0,1181.0,973.0,981.0,973.0,-0.5875318323843473,-0.538360391467607,-0.3778633323527696,-0.3561191836637488,-0.38021334194965695,2.0,0.008064516129032258,easy
Q000219,_____Australian and_____ European are there among the tourists.,"An, an","The, the","An, a","A, an",C,Easy,1.0,2.0,4,948.0,1165.0,848.0,848.0,848.0,-0.37270889044673644,-0.6048791581139505,-0.4261392914344096,-0.30215594888121533,-0.3249576954738266,2.0,0.008064516129032258,easy
Q000220,I have been looking for an apartment and I finally found the _____one.,good,airy,cheap,perfect,D,Easy,1.0,3.0,4,825.0,837.0,1013.0,1230.0,1230.0,-0.2787238533490317,-0.27228532488223245,-0.4139752702484845,-0.26122856288644125,-0.28034763226398185,3.0,0.008064516129032258,easy
Q000221,The youth should believe _____God.,upon,in,on,of,B,Easy,1.0,1.0,4,850.0,415.0,421.0,413.0,415.0,-0.7620754727086559,-0.8044354580529814,-0.6428109188086993,-0.23367567966006217,-0.2641257910967656,1.0,0.008064516129032258,easy
Q000222,He was born_____ India.,off,in,of,through,B,Easy,1.0,1.0,4,615.0,415.0,413.0,1262.0,415.0,-0.9097662452907633,-0.8709542246993252,-0.5660255350725475,-0.04573313271376449,-0.055269586068856215,1.0,0.008064516129032258,easy
Q000223,The convict tried his level best to justify himself but the judge looked_____ him and found him guilty.,around,at,through,to,B,Easy,1.0,1.0,4,1149.0,413.0,1262.0,427.0,413.0,0.16434846439729048,0.06030850834948573,-0.49684266457759885,0.009187744983749909,-0.055269586068856215,1.0,0.008064516129032258,easy
Q000224,His opponents launched a political _____against him.,regimen,remission,regale,tirade,D,Easy,1.0,3.0,4,1232.0,1444.0,1123.0,1132.0,1132.0,-0.5203996630288439,-0.6713979247602943,-0.2839722938239107,-0.3023759137101468,-0.32292996532792456,3.0,0.008064516129032258,easy
Q000225,What an_____ story! I am not _____enough yet to believe it.,incredible/credulous,incredulous/credible,increditable/believable,unbelievable/creditable,A,Easy,1.0,0.0,4,2529.0,2529.0,2829.0,2834.0,2529.0,-0.42641462593113916,-0.4053228581749197,0.4496702339521931,-0.276552980939561,-0.3310408859115327,0.0,0.008064516129032258,easy
Q000226,"Though this blanket is not made of wool, it has a ____texture.",wool,woollen,woolly,woolish,C,Easy,1.0,2.0,4,849.0,1257.0,1157.0,1254.0,1157.0,-0.38613532431783715,-0.33880409152857605,-0.33642963518821245,-0.2584057569940242,-0.2788268346545553,2.0,0.008064516129032258,easy
Q000227,None of the guests ate much at the party because the food looked _____.,unapproachable,unauthorized,unceremonious,unappetizing,D,Easy,1.0,3.0,4,1948.0,1757.0,1841.0,1748.0,1748.0,-0.26529741947793106,-0.2057665582358888,0.015440019325473257,-0.3595575797813262,-0.38426880224146104,3.0,0.008064516129032258,easy
Q000228,Trust _____ God and do the right.,in,with,at,by,A,Easy,1.0,0.0,4,415.0,844.0,413.0,419.0,415.0,-0.7755019065797566,-0.6713979247602943,-0.6438245872408597,-0.2363974849533412,-0.26716738631561865,0.0,0.008064516129032258,easy
Q000229,The accused was _____ as the counsel could not produce a witness.,let out,let off,let on,let aside,B,Easy,1.0,1.0,4,1168.0,1168.0,1068.0,1354.0,1168.0,-0.3458560227045351,-0.33880409152857605,-0.3058928736693798,-0.33273214458730416,-0.34067260410456734,1.0,0.008064516129032258,easy
Q000230,_____thousand species of butterflies have been identified.,As many as,As many,As much as,Much as,A,Moderate,2.0,0.0,4,1418.0,1118.0,1438.0,1129.0,1418.0,-0.4398410598022398,-0.6713979247602943,-0.2621784225324617,-0.2751411043450351,-0.32343689786440005,0.0,0.00684931506849315,moderate
Q000231,He_____ his mistake.,understood,solved,finished,realised,D,Moderate,2.0,3.0,4,1542.0,1153.0,1337.0,1325.0,1325.0,-0.9500455469040654,-0.9374729913456687,-0.22999444981136838,-0.2922926846390726,-0.28845855284759,3.0,0.00684931506849315,moderate
Q000232,Hard working people always succeed_____ whatever they do.,over,on,with,in,D,Moderate,2.0,3.0,4,844.0,421.0,844.0,415.0,415.0,-0.4532674936733405,-0.6048791581139505,-0.588959783350177,-0.20410485639638837,-0.26818125138856963,3.0,0.00684931506849315,moderate
Q000233,It has been years since I last _____him.,had met,met,meet,have met,B,Moderate,2.0,1.0,4,1142.0,626.0,827.0,1252.0,626.0,-0.6815168694820519,-0.6048791581139505,-0.4213243663816476,-0.16210625868353953,-0.16831554170289453,1.0,0.00684931506849315,moderate
Q000234,These murals are typical _____Tamil Nadu.,for,on,with,of,D,Moderate,2.0,3.0,4,627.0,421.0,844.0,413.0,413.0,-0.6680904356109513,-0.7379166914066378,-0.6167089566805685,-0.24660048995467435,-0.26716738631561865,3.0,0.00684931506849315,moderate
Q000235,The flight will land _____ six this evening.,in,on,at,upon,C,Moderate,2.0,2.0,4,415.0,421.0,413.0,850.0,413.0,-0.6278111339976492,-0.6048791581139505,-0.6428109188086993,-0.23367567966006217,-0.2641257910967656,2.0,0.00684931506849315,moderate
Q000236,I saw a _____ of cattle grazing in the meadow.,herd,bunch,group,litter,A,Moderate,2.0,0.0,4,819.0,1028.0,1057.0,1146.0,819.0,-0.6009582662554479,-0.47184162482126335,-0.39560252991557693,-0.31336960832186406,-0.3198883701090715,0.0,0.00684931506849315,moderate
Q000237,Our flight was_____ from Jaipur to Agra airport.,shifted,diverted,reverted,deflected,B,Moderate,2.0,1.0,4,1242.0,1338.0,1348.0,1412.0,1338.0,-0.5741053985132466,-0.6048791581139505,-0.23214849522970926,-0.3827588227138261,-0.39947677833572626,1.0,0.00684931506849315,moderate
Q000238,In these days of inflation we all have to_____ our belts.,shorten,strengthen,tighten,lesson,C,Moderate,2.0,2.0,4,1260.0,1556.0,1244.0,1150.0,1244.0,-0.4532674936733405,-0.4053228581749197,-0.24862060725231608,-0.2753660910528547,-0.27984069972750636,2.0,0.00684931506849315,moderate
Q000239,"He made a powerful_____ in the region, and people felt he would make a good leader in the days to come.",impression,discursive,marked,interest,A,Moderate,2.0,0.0,4,1541.0,1536.0,1128.0,1346.0,1541.0,0.16434846439729048,0.2598648082885166,-0.2054129903314782,-0.2553648311995063,-0.27629217197217776,0.0,0.00684931506849315,moderate
Q000240,The father_____ the throne for his son.,reverted,relished,relinquished,revived,C,Moderate,2.0,2.0,4,1348.0,1343.0,1738.0,1256.0,1738.0,-0.6949433033531526,-0.6713979247602943,-0.18843404409279116,-0.23520999954896255,-0.2413138269553677,2.0,0.00684931506849315,moderate
Q000241,One who tries may fail but one who does not try never_____.,succeeds,success,prosper,gain,A,Moderate,2.0,0.0,4,1331.0,1231.0,1264.0,815.0,1331.0,-0.42641462593113916,-0.33880409152857605,-0.32071777448972594,-0.21636553489737487,-0.22407812071520045,0.0,0.00684931506849315,moderate
Q000242,The lady_____ to be a close relative of ours.,turned out,turned in,turned up,turned about,A,Moderate,2.0,0.0,4,1558.0,1458.0,1458.0,1758.0,1558.0,-0.6143847001265486,-0.538360391467607,-0.11912446504382246,-0.31032581461686026,-0.3335755485939102,0.0,0.00684931506849315,moderate
Q000243,We all have_____ the widowed girl.,sympathy at,sympathy for,sympathy with,sympathy of,B,Moderate,2.0,1.0,4,1654.0,1754.0,1854.0,1654.0,1754.0,-0.7620754727086559,-0.7379166914066378,-0.032455814094106576,-0.356738040393187,-0.38426880224146104,1.0,0.00684931506849315,moderate
Q000244,They organized an event last month in _____with another company.,competition,collaboration,connection,regulation,B,Difficult,3.0,1.0,4,1632.0,1823.0,1531.0,1543.0,1823.0,-0.3592824565756358,-0.47184162482126335,-0.08149202449986688,-0.31694095516920384,-0.3376310088857143,1.0,0.00819672131147541,difficult
Q000245,He_____ to help me and called me a fool.,refused,denied,offered,thought,A,Difficult,3.0,0.0,4,1249.0,1117.0,1230.0,1251.0,1249.0,-0.6815168694820519,-0.538360391467607,-0.2946158123615951,-0.38912097185860056,-0.4177263496488446,0.0,0.00819672131147541,difficult
Q000246,The river abounds _____ fish and crocodiles.,with,of,at,on,A,Difficult,3.0,0.0,4,844.0,413.0,413.0,421.0,844.0,-0.6278111339976492,-0.6713979247602943,-0.6438245872408597,-0.2363785100791715,-0.26716738631561865,0.0,0.00819672131147541,difficult
Q000247,The auditor was asked to _____ the accounts.,count,check,spot,cheque,B,Difficult,3.0,1.0,4,1053.0,1010.0,854.0,1134.0,1010.0,-0.6278111339976492,-0.6048791581139505,-0.3954758213615569,-0.3344700304408426,-0.3437141993234204,1.0,0.00819672131147541,difficult
Q000248,Every student had to abide _____the rules and regulations of the hostel.,in,by,against,with,B,Difficult,3.0,1.0,4,415.0,419.0,1212.0,844.0,419.0,-0.2518709856068304,-0.33880409152857605,-0.5425844525788378,-0.06443710129811546,-0.08163007796558264,1.0,0.00819672131147541,difficult
Q000249,Coventry is _____ Birmingham.,nearby,next,beside,near,D,Difficult,3.0,3.0,4,1120.0,847.0,1119.0,822.0,822.0,-0.8292076420641593,-0.8709542246993252,-0.4135951445864244,-0.28650917274234367,-0.33458941366686124,3.0,0.00819672131147541,difficult
Q000250,"To err is_____, to forgive divine.",human,natural,kindness,humane,A,Difficult,3.0,0.0,4,1037.0,1254.0,1332.0,1137.0,1037.0,-0.7620754727086559,-0.7379166914066378,-0.3056394565613397,-0.3222200966024986,-0.33611021127628776,0.0,0.00819672131147541,difficult
Q000251,Next summer we're going _____ a trip to Canada.,to,on,for,over,B,Difficult,3.0,1.0,4,427.0,421.0,627.0,844.0,421.0,-0.5875318323843473,-0.538360391467607,-0.6149350369242877,-0.2503034597536568,-0.2712228466074227,1.0,0.00819672131147541,difficult
Q000252,Some interesting matters_____ in our discussion yesterday.,came in,came up,got up,came about,B,Difficult,3.0,1.0,4,1138.0,1138.0,1079.0,1438.0,1138.0,-0.4398410598022398,-0.6713979247602943,-0.30145807427867793,-0.2891777407456533,-0.30366652894185525,1.0,0.00819672131147541,difficult
Q000253,"As soon as this workshop is over, I am going to ______ every duty and go on a holiday.",sidetrack,overthrow,close down,abandon,D,Difficult,3.0,3.0,4,1437.0,1460.0,1534.0,1202.0,1202.0,-0.06390091141142096,0.12682727499582935,-0.1950228889018339,-0.3081194118368956,-0.31735370742669394,3.0,0.00819672131147541,difficult
Q000254,He loaded the ______of cotton on the truck.,bundles,bales,baskets,bunches,B,Difficult,3.0,1.0,4,1233.0,1019.0,1218.0,1228.0,1019.0,-0.64123756786875,-0.6048791581139505,-0.31349538691058293,-0.3484964218817183,-0.3771717467308039,1.0,0.00819672131147541,difficult
Q000255,"Poetry is a _____ form of expression in which the particularity of the word and the image to evoke feeling, assumes great importance.",suppressed,patronized,digressed,compressed,D,Difficult,3.0,3.0,4,1570.0,1550.0,1423.0,1545.0,1545.0,0.5671414805303107,0.3929023415812039,-0.13737049682271002,-0.3860663082382557,-0.411136226674663,3.0,0.00819672131147541,difficult
Q000256,Whoop it up,be continually reminded of an unpleasant topic,"enjoying in noisy way, usually in a group",be totally ignorant or incompetent,used as an exhortation to overcome or be rid of something.,B,Very Easy,0.0,1.0,6,5041.0,4649.0,3858.0,6265.0,4649.0,-1.0708834517439714,-0.9374729913456687,1.6017044071025102,0.565511728711117,0.7345313057599855,1.0,0.011111111111111112,very_easy
Q000257,With a vengeance,A complete disaster,having similar views or attitude to something,To look out for something without particular attention,Used to emphasize the degree to which somethings occurs,D,Very Easy,0.0,3.0,6,2316.0,5034.0,5846.0,5933.0,5933.0,-1.003751282388468,-0.9374729913456687,1.5150357561527943,1.266451569756707,1.3479196748953504,3.0,0.011111111111111112,very_easy
Q000258,Up against the wall,To take care of themselves and their own interests and safety,In a disorderly fashion,In an inextricable situation,Performing well in a difficult or competitive situation,C,Very Easy,0.0,2.0,6,6540.0,2644.0,3222.0,6008.0,3222.0,-0.963471980775166,-0.8709542246993252,1.4244391400284568,1.532790429723216,1.4893538525720171,2.0,0.011111111111111112,very_easy
Q000259,Reap the whirlwind,Providing that other factors or circumstance remain the same.,Suffer negative consequence as a result of one’s actions,An Indication that something is accepted or regarded favourably,Believing that moderation is more satisfying than excess,B,Very Easy,0.0,1.0,6,6628.0,6105.0,6690.0,6081.0,6105.0,-0.9768984146462667,-0.9374729913456687,2.3228027880306286,-0.1208468382073178,-0.17693339482297818,1.0,0.011111111111111112,very_easy
Q000260,of the first water,leading a comfortable life,acting contrary to the one's interests,critically important,of the best quality,D,Very Easy,0.0,3.0,6,3111.0,4327.0,2539.0,2365.0,2365.0,-0.9768984146462667,-0.8709542246993252,0.655064800018698,0.44712112414950134,0.5089463270283844,3.0,0.011111111111111112,very_easy
Q000261,weather the storm,be absolutely unwilling to cooperate,fall over in a sudden or dramatic way,survive a period of difficulty,dispute a decision or choice already made,C,Very Easy,0.0,2.0,6,4026.0,4147.0,3569.0,4649.0,3569.0,-0.9903248485173675,-0.9374729913456687,1.1681077352458906,-0.00303331553573695,0.06183182985698618,2.0,0.011111111111111112,very_easy
Q000262,spin your wheels,set an activity in motion,waste your time or efforts,a firmly held belief,with great affection or enthusiasm,B,Very Easy,0.0,1.0,6,2961.0,3148.0,2450.0,3876.0,3148.0,-1.003751282388468,-0.9374729913456687,0.666848695542563,0.14594305237671465,0.23723048747751202,1.0,0.011111111111111112,very_easy
Q000263,wear the green willow,to do something for someone as an act of kindness,suffer unrequited love,cause someone to be very frightened,producing a lavish celebrating feast,B,Very Easy,0.0,1.0,6,5370.0,2737.0,4029.0,4154.0,2737.0,-0.9366191130329647,-0.8709542246993252,1.1553101712898652,0.6396194501928916,0.8490980590034504,1.0,0.011111111111111112,very_easy
Q000264,wild and woolly,uncouth in appearance or behaviour,either too much of something or too little,near to perfection,ignoring all obligations,A,Very Easy,0.0,0.0,6,3954.0,4727.0,2254.0,2943.0,3954.0,-1.0171777162595688,-0.9374729913456687,0.8496891389934986,0.6544787688805012,0.7679888531673691,0.0,0.011111111111111112,very_easy
Q000265,give it a whirl,to be engaged in cheating,to completely destroy something,attach or criticize someone,to try out something,D,Very Easy,0.0,3.0,6,2958.0,3569.0,3225.0,2489.0,2489.0,-1.0171777162595688,-0.8709542246993252,0.6422672360626728,0.008912039105636524,0.06183182985698618,3.0,0.011111111111111112,very_easy
Q000266,alarums and Excursions,value for money and time,confused activity and uproar,source of fun or amusement,derive excitement or pleasure from,B,Very Easy,0.0,1.0,6,2941.0,3339.0,3156.0,3938.0,3339.0,-0.9231926791618641,-0.9374729913456687,0.7858280277673922,-0.018725240573241795,0.019756429329519,1.0,0.011111111111111112,very_easy
Q000267,up in the air (about someone or something),in prison,still to be settled,on the wrong track,enjoying great success,B,Very Easy,0.0,1.0,6,1373.0,2452.0,2273.0,2749.0,2452.0,-0.6546640017398506,-0.6048791581139505,0.21221840371861472,0.14812328258544818,0.2118838606537366,1.0,0.011111111111111112,very_easy
Q000268,give oneself airs,be intelligent,penniless,pretend to be good,prepare for a difficulty,C,Very Easy,0.0,2.0,6,1846.0,1438.0,2344.0,2936.0,2344.0,-0.9903248485173675,-0.9374729913456687,0.17635988293093988,0.2030164191818734,0.2737296301037486,2.0,0.011111111111111112,very_easy
Q000269,be all one to,succeed in doing something,searching thoroughly,not in keeping with the rules,make no difference,D,Easy,1.0,3.0,6,3131.0,2526.0,3374.0,2246.0,2246.0,-1.04403058400177,-0.8709542246993252,0.5201201899873422,0.07704389415003282,0.08616459160781058,3.0,0.008064516129032258,easy
Q000270,an article of faith,a formula for carrying a curse on someone,become very successful or famous,a firmly held belief,angry or Agitated,C,Easy,1.0,2.0,6,4556.0,3718.0,2450.0,2245.0,2450.0,-0.963471980775166,-0.8709542246993252,0.734511063389271,0.6550615897085079,0.6858657822583367,2.0,0.008064516129032258,easy
Q000271,in the ascendant,a general view from above,rising in power or influence,to reject someone,waiting quietly for a good opportunity,B,Easy,1.0,1.0,6,2943.0,3349.0,2174.0,4342.0,3349.0,-1.003751282388468,-0.9374729913456687,0.7141109861920425,0.4632672175963355,0.613374429542339,1.0,0.008064516129032258,easy
Q000272,bring home the bacon,an action to be taken when all else fails,be grateful for what we have,supply material support,setback for someone or something,C,Easy,1.0,2.0,6,4535.0,3248.0,2864.0,3727.0,2864.0,-0.9500455469040654,-0.8709542246993252,0.9125365817874447,0.27768214337287417,0.3614289589140115,2.0,0.008064516129032258,easy
Q000273,have the ball at your feet.,be able to recognize,miss something of what is going on around,enable someone to avoid humiliation,to be in the best position to do something,D,Easy,1.0,3.0,6,2426.0,4576.0,4014.0,4658.0,4658.0,-0.8560605098063607,-0.7379166914066378,1.077257702013513,0.5979579968941436,0.6458181118767715,3.0,0.008064516129032258,easy
Q000274,after one's own heart,sharing or having one's tastes or views.,infatuation with a person which is not reciprocated.,memorise something by heart.,don't have the courage to do something bad for a good person.,A,Easy,1.0,0.0,6,4535.0,5730.0,3344.0,6576.0,4535.0,-0.9366191130329647,-0.8709542246993252,1.6488399891979697,0.9789115853294688,1.1527506483522798,0.0,0.008064516129032258,easy
Q000275,pull the wool over someone's eyes,to protect someone.,to keep oneself warm.,deceive someone by telling lies.,to pretend to be blind to the other person's bad behaviour.,C,Easy,1.0,2.0,6,2385.0,2567.0,3706.0,6385.0,3706.0,-0.7755019065797566,-0.7379166914066378,0.9973046044268598,1.4201836302601494,1.5420748363654702,2.0,0.008064516129032258,easy
Q000276,head over heels,to do things exactly opposite of what is expected.,madly in love.,to do stupid things.,to unknowingly dive into an unpleasant situation.,B,Easy,1.0,1.0,6,5470.0,1935.0,2470.0,5386.0,1935.0,-1.0171777162595688,-0.9374729913456687,1.0249270692032313,1.4514199248437536,1.3063512069043588,1.0,0.008064516129032258,easy
Q000277,In deep water,To die,In great difficulty,To fail completely,To surrender,B,Easy,1.0,1.0,6,1032.0,2332.0,2226.0,1659.0,2332.0,-1.04403058400177,-0.9374729913456687,0.009738134394570896,0.15380974657769136,0.17335698788159798,1.0,0.008064516129032258,easy
Q000278,In the egg,In an untidy state,In a dilemma,In an early stage,In bodily form,C,Easy,1.0,2.0,6,2222.0,1544.0,2122.0,1824.0,2122.0,-1.0843098856150721,-0.9374729913456687,0.06840419490585518,-0.14231042251176806,-0.1419550498061681,2.0,0.008064516129032258,easy
Q000279,Cut in on,Acknowledge,interrupt,Evade,produce,B,Moderate,2.0,1.0,6,1592.0,1446.0,985.0,1254.0,1446.0,-1.097736319486173,-0.9374729913456687,-0.24013113413297257,-0.18748339151023236,-0.1779472598959292,1.0,0.00684931506849315,moderate
Q000280,Draw a blank,Absent minded,To be unsuccessful,Come to an end,To fall a victim,B,Moderate,2.0,1.0,6,1789.0,2226.0,1820.0,2026.0,2226.0,-1.0574570178728708,-0.9374729913456687,0.08728376945484301,-0.24757834218532115,-0.2641257910967656,1.0,0.00684931506849315,moderate
Q000281,Give up ghost,To feel superior,To overcome one's fear,To give encouragement,To die,D,Moderate,2.0,3.0,6,2030.0,2656.0,2535.0,1032.0,1032.0,-1.04403058400177,-0.9374729913456687,0.13695352263070357,0.2968771375556903,0.33760312969966266,3.0,0.00684931506849315,moderate
Q000282,To lead astray,To take back what you have said,To misguide,To achieve two results with one effort,To apologize humbly,B,Moderate,2.0,1.0,6,3540.0,1541.0,4223.0,2336.0,1541.0,-1.0306041501306695,-0.9374729913456687,0.5661153950966212,0.7658888863036982,0.8739377532907503,1.0,0.00684931506849315,moderate
Q000283,To make a pile,To keep at a distance,To make a lot of money,To aggravate the situation,To face the risk,B,Moderate,2.0,1.0,6,2535.0,2633.0,3027.0,2026.0,2633.0,-1.0306041501306695,-0.8709542246993252,0.3863159569421668,-0.03545245097722047,0.021784159475421033,1.0,0.00684931506849315,moderate
Q000284,Back out of,Decimate,Record,Withdraw,Pertain,C,Moderate,2.0,2.0,6,1282.0,1107.0,1312.0,1208.0,1312.0,-1.0708834517439714,-0.9374729913456687,-0.28675988201235186,-0.36124527386814076,-0.3817341395590835,2.0,0.00684931506849315,moderate
Q000285,A stiff-necked person,Honest and open,An obstinate person,A source of quarrel,Ordinary person,B,Moderate,2.0,1.0,6,2009.0,2316.0,2340.0,2008.0,2316.0,-0.9366191130329647,-0.9374729913456687,0.19017111531912562,-0.26632785681147203,-0.31735370742669394,1.0,0.00684931506849315,moderate
Q000286,Make away with,To compensate,Eliminate,To find out,To understand,B,Moderate,2.0,1.0,6,1737.0,1396.0,1534.0,1754.0,1396.0,-1.0306041501306695,-0.9374729913456687,-0.09517654833403255,-0.27965553732883675,-0.30417346147833074,1.0,0.00684931506849315,moderate
Q000287,To put one out of countenance,To put a difficulty in the way of progress,To provoke quarrel,To make one feel ashamed,To deceive someone,C,Difficult,3.0,2.0,6,4656.0,2253.0,2833.0,2228.0,2833.0,-0.8292076420641593,-0.7379166914066378,0.6079292179232386,0.7080259042447251,0.7451768890259711,2.0,0.00819672131147541,difficult
Q000288,A cock and bull story,An important story,An imaginary story,A long story,A short story,B,Difficult,3.0,1.0,6,2221.0,2221.0,1626.0,1727.0,2221.0,-0.9366191130329647,-0.8044354580529814,0.07892100488951954,-0.13186668964673012,-0.1840304503336353,1.0,0.00819672131147541,difficult
Q000289,Break a lance with,To appear suddenly,To argue against,To burst out,To break promise,B,Difficult,3.0,1.0,6,2236.0,2038.0,1642.0,2039.0,2038.0,-0.9768984146462667,-0.8709542246993252,0.09919437353272793,-0.20080485350414473,-0.1845373828701108,1.0,0.00819672131147541,difficult
Q000290,To cut the crackle,To stop talking aimlessly,To be under one's subjugation,To foment trouble,To ridicule,A,Difficult,3.0,0.0,6,2958.0,3326.0,2140.0,1546.0,2958.0,-0.9768984146462667,-0.8709542246993252,0.35451210988313364,0.3612665497472363,0.4166846053898419,0.0,0.00819672131147541,difficult
